book_name,book_Price,book_reviews,book_rating,book_date,book_discount,book_author
Enterprise Application Development with C# 10 and .NET 6 - Second Edition: Become a professional .NET developer by learning expert techniques for building scalable applications,"2,941",2,4.5 out of 5 stars,17-Jun-22,(20% off),"by Ravindra Akella , Arun Kumar Tamirisa, et al. | 17 June 2022"
"Micro State Management with React Hooks: Explore custom hooks libraries like Zustand, Jotai, and Valtio to manage global states","2,466",9,4.8 out of 5 stars,25-Feb-22,(20% off),by Daishi Kato | 25 February 2022
"Mastering ROS for Robotics Programming: Design, build, and simulate complex robots using the Robot Operating System","3,489",17,3.8 out of 5 stars,21-Dec-15,(19% off),by Lentin Joseph | 21 December 2015
R Deep Learning Projects: Master the techniques to design and develop neural network models in R,"2,226",8,4.1 out of 5 stars,22-Feb-18,(20% off),by Yuxi (Hayden) Liu and Pablo Maldonado | 22 February 2018
Architectural Patterns: Uncover essential patterns in the most indispensable realm of enterprise architecture,"3,100",8,3.8 out of 5 stars,22-Dec-17,(20% off),"by Pethuru Raj Chelliah, Harihara Subramanian , et al. | 22 December 2017"
RESTful Java Web Services - Second Edition,"2,559",10,3.9 out of 5 stars,22-Sep-15,(27% off),by Jobinesh Purushothaman | 22 September 2015
"C# 8.0 and .NET Core 3.0 – Modern Cross-Platform Development: Build applications with C#, .NET Core, Entity Framework Core, ASP.NET Core, and ML.NET using Visual Studio Code, 4th Edition","5,079",401,4.3 out of 5 stars,31-Oct-19,(19% off),by Mark J. Price | 31 October 2019
"Learning Angular: A no-nonsense beginner's guide to building web applications with Angular 10 and TypeScript, 3rd Edition","2,226",52,4.1 out of 5 stars,07-Sep-20,(20% off),by Aristeidis Bampakos and Pablo Deeleman | 7 September 2020
"Cybersecurity Threats, Malware Trends, and Strategies: Learn to mitigate exploits, malware, phishing, and other social engineering attacks","1,800",38,4.5 out of 5 stars,29-May-20,(22% off),by Tim Rains | 29 May 2020
Robot Framework Test Automation,"1,828",17,2.9 out of 5 stars,25-Oct-13,(20% off),by Sumit Bisht | 25 October 2013
"Angular Projects: Build modern web apps by exploring Angular 12 with 10 different projects and cutting-edge technologies, 2nd Edition","2,226",45,4.3 out of 5 stars,05-Jul-21,(20% off),by Aristeidis Bampakos and Mark Thompson | 5 July 2021
Incident Response Techniques for Ransomware Attacks: Understand modern ransomware attacks and build an incident response strategy to work through them,498,13,4.8 out of 5 stars,14-Apr-22,(44% off),by Oleg Skulkin | 14 April 2022
"Kubernetes – An Enterprise Guide: Effectively containerize applications, integrate enterprise systems, and scale applications in your enterprise","2,784",15,4.4 out of 5 stars,22-Dec-21,(20% off),by Marc Boorshtein and Scott Surovich | 22 December 2021
"Hands-On Exploratory Data Analysis with Python: Perform EDA techniques to understand, summarize, and investigate your data","2,464",12,3.6 out of 5 stars,27-Mar-20,(20% off),by Suresh Kumar Mukhiya and Usman Ahmed | 27 March 2020
VuePress Quick Start Guide: Build blazing-fast static websites with the power of Vue.js,618,,,28-Sep-18,(12% off),by Sufyan bin Uzayr | 28 September 2018
Learn Azure Sentinel: Integrate Azure security with artificial intelligence to build secure cloud systems,"2,226",47,4.5 out of 5 stars,07-Apr-20,(20% off),"by Richard Diver , Gary Bushey , et al. | 7 April 2020"
Learning Pixelmator,"1,510",46,3.5 out of 5 stars,16-Apr-13,(20% off),by Mark Stagi | 16 April 2013
Architecting AI Solutions on Salesforce: Design powerful and accurate AI-driven state-of-the-art solutions tailor-made for modern business demands,"2,466",5,4.6 out of 5 stars,12-Nov-21,(20% off),by Lars Malmqvist | 12 November 2021
Learning Salesforce Visual Workflow and Process Builder -,"3,100",5,4.2 out of 5 stars,18-May-17,(20% off),by Rakesh Gupta | 18 May 2017
"IPython Interactive Computing and Visualization Cookbook: Over 100 hands-on recipes to sharpen your skills in high-performance numerical computing and data science in the Jupyter Notebook, 2nd Edition","2,226",19,4.6 out of 5 stars,31-Jan-18,(20% off),by Cyrille Rossant | 31 January 2018
Mastering Python Scripting for System Administrators: Write scripts and automate them for real-world administration tasks using Python,"2,782",10,4.0 out of 5 stars,30-Jan-19,(20% off),by Ganesh Sanjiv Naik | 30 January 2019
Mastering Modern Web Penetration Testing,"2,784",45,4.0 out of 5 stars,28-Oct-16,(20% off),by Prakhar Prasad | 28 October 2016
Practical DevOps,"1,500",8,4.0 out of 5 stars,06-Jan-16,(40% off),by Joakim Verona | 6 January 2016
"Mastering Ros for Robotics Programming, Second Edition: Design, build, and simulate complex robots using the Robot Operating System, 2nd Edition","1,499",12,4.3 out of 5 stars,01-Jan-18,(62% off),by Lentin Joseph Jonathan Cacace | 1 January 2018
Hands-On Domain-Driven Design with .NET Core: Tackling complexity in the heart of software by putting DDD principles into practice,"2,464",112,4.4 out of 5 stars,30-Apr-19,(20% off),by Alexey Zimarev | 30 April 2019
"The Art of Modern PHP 8: Learn how to write modern, performant, and enterprise-ready code with the latest PHP features and practices","2,464",5,4.0 out of 5 stars,26-Oct-21,(20% off),by Joseph Edmonds and Lorna Jane Mitchell | 26 October 2021
"Mastering Xamarin.Forms: App architecture techniques for building multi-platform, native mobile apps with Xamarin.Forms 4, 3rd Edition","1,828",65,4.1 out of 5 stars,30-Dec-19,(20% off),by Ed Snider and David Ortinau | 30 December 2019
"Learning R Programming: Language, tools, and practical techniques","2,782",5,4.5 out of 5 stars,25-Oct-16,(20% off),by Kun Ren | 25 October 2016
Ember.js Cookbook,"3,100",5,4.0 out of 5 stars,06-Jan-16,(20% off),by Erik Hanchett | 6 January 2016
Building Web Apps with Spring 5 and Angular,800,10,3.3 out of 5 stars,24-Aug-17,(73% off),by Ajitesh Shukla | 24 August 2017
"Learn Python by Building Data Science Applications: A fun, project-based guide to learning Python 3 while building real-world apps","2,226",10,4.3 out of 5 stars,30-Aug-19,(20% off),by Philipp Kats and David Katz | 30 August 2019
Extending and Modifying LAMMPS Writing Your Own Source Code: A pragmatic guide to extending LAMMPS as per custom simulation requirements,"3,100",7,4.5 out of 5 stars,19-Feb-21,(20% off),"by Dr. Shafat Mubin, Jichen Li , et al. | 19 February 2021"
Appium Essentials,"1,828",15,2.8 out of 5 stars,09-Apr-15,(20% off),by Manoj Hans | 9 April 2015
"C# and .NET Core Test-Driven Development: Dive into TDD to create flexible, maintainable, and production-ready .NET Core applications","2,464",23,3.8 out of 5 stars,18-May-18,(20% off),by Ayobami Adewole | 18 May 2018
Qt5 Python GUI Programming Cookbook: Building responsive and powerful cross-platform applications with PyQt,"3,100",23,3.4 out of 5 stars,30-Jul-18,(20% off),by B. M. Harwani | 30 July 2018
Seven NoSQL Databases in a Week: Get up and running with the fundamentals and functionalities of seven of the most popular NoSQL databases,"2,226",12,4.1 out of 5 stars,29-Mar-18,(20% off),"by Xun (Brian) Wu , Sudarshan Kadambi, et al. | 29 March 2018"
Data Engineering with Google Cloud Platform: A practical guide to operationalizing scalable data analytics systems on GCP,"3,100",6,4.8 out of 5 stars,31-Mar-22,(20% off),by Adi Wijaya | 31 March 2022
"Responsive Web Design with HTML5 and CSS: Develop future-proof responsive websites using the latest HTML5 and CSS techniques, 3rd Edition","2,782",234,4.5 out of 5 stars,30-Apr-20,(20% off),by Ben Frain | 30 April 2020
Swift iOS Programming for Kids: Help your kids build simple and engaging applications with Swift 3.0,"2,226",2,2.9 out of 5 stars,22-Mar-17,(20% off),by Steffen D. Sommer and Jim Campagno | 22 March 2017
Real-World SRE: The Survival Guide for Responding to a System Outage and Maximizing Uptime,"2,464",21,4.1 out of 5 stars,31-Aug-18,(20% off),by Nat Welch | 31 August 2018
Learn Wireshark -: A definitive guide to expertly analyzing protocols and troubleshooting networks using Wireshark,"2,703",2,4.5 out of 5 stars,26-Aug-22,(20% off),by Lisa Bock | 26 August 2022
"Automate Everyday Tasks in Jira: A practical, no-code approach for Jira admins and power users to automate everyday processes","2,464",14,4.4 out of 5 stars,22-Jan-21,(20% off),by Gareth Cantrell | 22 January 2021
Building a RESTful Web Service with Spring,"1,828",18,3.9 out of 5 stars,14-Oct-15,(20% off),by Ludovic Dewailly | 14 October 2015
PowerShell for SQL Server Essentials,"1,828",15,4.1 out of 5 stars,25-Feb-15,(20% off),by Donabel Santos | 25 February 2015
"Implementing Cloud Design Patterns for AWS: Solutions and design ideas for solving system design problems, 2nd Edition","2,464",3,3.7 out of 5 stars,30-Apr-19,(20% off),"by Sean Keery , Clive Harber , et al. | 30 April 2019"
PySpark Cookbook: Over 60 recipes for implementing big data processing and analytics using Apache Spark and Python,"2,464",10,3.9 out of 5 stars,29-Jun-18,(20% off),by Denny Lee and Tomasz Drabas | 29 June 2018
PySpark Cookbook: Over 60 recipes for implementing big data processing and analytics using Apache Spark and Python,"2,464",10,3.9 out of 5 stars,29-Jun-18,(20% off),by Denny Lee and Tomasz Drabas | 29 June 2018
Hands-On Deep Learning for IoT: Train neural network models to develop intelligent IoT applications,"2,226",6,4.2 out of 5 stars,27-Jun-19,(20% off),by Md. Rezaul Karim | 27 June 2019
Mastering C# and .NET Framework,"2,782",3,3.5 out of 5 stars,07-Dec-16,(20% off),by Marino Posadas | 7 December 2016
Getting Started with Talend Open Studio for Data Integration,"2,783",24,3.9 out of 5 stars,06-Nov-12,(20% off),by Jonathan Bowen | 6 November 2012
"Cyber Warfare – Truth, Tactics, and Strategies: Strategic concepts and truths to help you and your organization survive on the battleground of cyber warfare","1,828",110,4.5 out of 5 stars,25-Feb-20,(20% off),by Dr. Chase Cunningham and Gregory J. Touhill | 25 February 2020
AWS Certified Advanced Networking - Specialty Exam Guide: Build your knowledge and technical expertise as an AWS-certified networking specialist,"2,226",24,4.1 out of 5 stars,27-May-19,(20% off),by Marko Sluga | 27 May 2019
Learn Ethical Hacking from Scratch: Your stepping stone to penetration testing,"2,782",75,4.5 out of 5 stars,31-Jul-18,(20% off),by Zaid Sabih | 31 July 2018
"Azure DevOps Server 2019 Cookbook: Proven recipes to accelerate your DevOps journey with Azure DevOps Server 2019 (formerly TFS), 2nd Edition","3,100",9,3.7 out of 5 stars,03-May-19,(20% off),by Tarun Arora and Utkarsh Shigihalli | 3 May 2019
Mastering Apex Programming: A developer’s guide to learning advanced techniques and best practices for building robust Salesforce applications,"3,100",31,4.5 out of 5 stars,20-Nov-20,(20% off),by Paul Battisson and Mike Wheeler | 20 November 2020
Node.js Design Patterns,"3,100",28,4.6 out of 5 stars,30-Dec-14,(20% off),by Mario Casciaro | 30 December 2014
IoT Projects with Bluetooth Low Energy,"2,226",13,3.0 out of 5 stars,31-Aug-17,(20% off),by Madhur Bhargava | 31 August 2017
"Mastering Machine Learning on AWS: Advanced machine learning in Python using SageMaker, Apache Spark, and TensorFlow","2,226",40,4.3 out of 5 stars,20-May-19,(20% off),by Dr. Saket S.R. Mengle and Maximo Gurmendez | 20 May 2019
"Hands-On Big Data Analytics with PySpark: Analyze large datasets and discover techniques for testing, immunizing, and parallelizing Spark jobs","1,510",6,2.4 out of 5 stars,29-Mar-19,(20% off),by Rudy Lai and Bartłomiej Potaczek | 29 March 2019
Natural Language Processing with TensorFlow -: The definitive NLP book to implement the most sought-after machine learning models and tasks,"2,386",6,4.1 out of 5 stars,30-Jun-22,(20% off),by Thushan Ganegedara | 30 June 2022
Incident response with Threat Intelligence: Practical insights into developing an incident response capacity through intelligence-based threat hunting,"2,703",9,4.8 out of 5 stars,10-Jun-22,(20% off),by Roberto Martinez | 10 June 2022
"Mastering AWS CloudFormation: Plan, develop, and deploy your cloud infrastructure effectively using AWS CloudFormation","2,464",18,4.2 out of 5 stars,08-May-20,(20% off),by Karen Tovmasyan | 8 May 2020
Mastering jBPM6,"3,736",7,3.2 out of 5 stars,25-Jun-15,(20% off),by Simone Fiorini and Arun V Gopalakrishnan | 25 June 2015
Microsoft Power BI Performance Best Practices: A comprehensive guide to building consistently fast Power BI solutions,"2,782",11,4.7 out of 5 stars,22-Apr-22,(20% off),by Bhavik Merchant and Christopher Webb | 22 April 2022
The The Reinforcement Learning Workshop: Learn how to apply cutting-edge reinforcement learning algorithms to a wide range of control problems,"2,782",12,3.8 out of 5 stars,18-Aug-20,(20% off),"by Alessandro Palmas , Emanuele Ghelfi, et al. | 18 August 2020"
Responsive Web Design with Html5 and Css3 - Second Edition: Build responsive and future-proof websites to meet the demands of modern web users,"2,950",79,4.5 out of 5 stars,01-Jan-15,(45% off),by Ben Frain | 1 January 2015
Mastering Python for Networking and Security: Leverage Python scripts and libraries to overcome networking and security issues,"2,465",19,4.2 out of 5 stars,28-Sep-18,(20% off),by José Manuel Ortega | 28 September 2018
Splunk Best Practices,"2,782",8,4.7 out of 5 stars,06-Jan-16,(20% off),by Travis Marlette | 6 January 2016
Mastering Python Data Visualization: Generate effective results in a variety of visually appealing charts using the plotting packages in Python,"3,100",1,2.0 out of 5 stars,27-Oct-15,(20% off),by Kirthi Raman | 27 October 2015
Hands-On Software Engineering with Golang: Move beyond basic programming to design and build reliable software with clean code,"3,100",18,4.7 out of 5 stars,24-Jan-20,(20% off),by Achilleas Anagnostopoulos | 24 January 2020
"Deep Reinforcement Learning with Python: Master classic RL, deep RL, distributional RL, inverse RL, and more with OpenAI Gym and TensorFlow, 2nd Edition","2,782",50,4.5 out of 5 stars,30-Sep-20,(20% off),by Sudharsan Ravichandiran | 30 September 2020
"Machine Learning for OpenCV 4: Intelligent algorithms for building image processing apps using OpenCV 4, Python, and scikit-learn, 2nd Edition","2,600",5,5.0 out of 5 stars,06-Sep-19,(26% off),"by Aditya Sharma, Vishwesh Ravi Shrimali , et al. | 6 September 2019"
AWS Certified Security – Specialty Exam Guide: Build your cloud security knowledge and expertise as an AWS Certified Security Specialist (SCS-C01),"2,464",55,4.6 out of 5 stars,07-Sep-20,(20% off),by Stuart Scott | 7 September 2020
Quantum Computing in Practice with Qiskit® and IBM Quantum Experience®: Practical recipes for quantum computer coding at the gate and algorithm level with Python,"2,464",19,4.1 out of 5 stars,23-Nov-20,(20% off),by Hassi Norlén | 23 November 2020
"Interactive Data Visualization with Python: Present your data as an effective and compelling story, 2nd Edition","2,782",19,4.3 out of 5 stars,14-Apr-20,(20% off),"by Abha Belorkar, Sharath Chandra Guntuku , et al. | 14 April 2020"
Natural Language Processing with Python Quick Start Guide: Going from a Python developer to an effective Natural Language Processing Engineer,"1,828",1,4.0 out of 5 stars,30-Nov-18,(20% off),by Nirant Kasliwal | 30 November 2018
"Azure Stack Hub Demystified: Building hybrid cloud, IaaS, and PaaS solutions","2,782",6,4.0 out of 5 stars,07-Oct-21,(20% off),by Richard Young | 7 October 2021
"Scaling Agile with Jira Align: A practical guide to strategically scaling agile across teams, programs, and portfolios in enterprises","2,464",25,4.7 out of 5 stars,20-Nov-20,(20% off),by Dean MacNeil and Aslam Cader | 20 November 2020
"Azure Stack Hub Demystified: Building hybrid cloud, IaaS, and PaaS solutions","2,782",6,4.0 out of 5 stars,07-Oct-21,(20% off),by Richard Young | 7 October 2021
"Scaling Agile with Jira Align: A practical guide to strategically scaling agile across teams, programs, and portfolios in enterprises","2,464",25,4.7 out of 5 stars,20-Nov-20,(20% off),by Dean MacNeil and Aslam Cader | 20 November 2020
"Practical Mobile Forensics: Forensically investigate and analyze iOS, Android, and Windows 10 devices, 4th Edition","2,464",72,4.7 out of 5 stars,09-Apr-20,(20% off),"by Rohit Tamma , Oleg Skulkin, et al. | 9 April 2020"
Enterprise Integration with Azure Logic Apps: Integrate legacy systems with innovative solutions,"2,782",2,4.0 out of 5 stars,23-Dec-21,(20% off),by Matthew Bennett and Tim Childe | 23 December 2021
Hands-On High Performance with Go: Boost and optimize the performance of your Golang applications at scale with resilience,"2,782",19,4.0 out of 5 stars,24-Mar-20,(20% off),by Bob Strecansky | 24 March 2020
Getting Started with Tableau 2018.x: Get up and running with the new features of Tableau 2018 for impactful data visualization,"2,300",7,3.9 out of 5 stars,28-Sep-18,(41% off),by Tristan Guillevin | 28 September 2018
Groovy 2 Cookbook,"3,100",3,3.4 out of 5 stars,22-Oct-13,(20% off),by Andrey Adamovich and Luciano Fiandesio | 22 October 2013
"Xamarin.Forms Projects: Build multiplatform mobile apps and a game from scratch using C# and Visual Studio 2019, 2nd Edition","2,464",33,3.7 out of 5 stars,19-Jun-20,(20% off),"by Daniel Hindrikes , Johan Karlsson , et al. | 19 June 2020"
Hands-On Data Structures and Algorithms with Kotlin: Level up your programming skills by understanding how Kotlin's data structure works,"2,226",3,3.5 out of 5 stars,28-Feb-19,(20% off),by Chandra Sekhar Nayak and Rivu Chakraborty | 28 February 2019
Mastering MongoDB 3.x,"2,226",10,3.7 out of 5 stars,17-Nov-17,(20% off),by Alex Giamas | 17 November 2017
Mastering FreeSWITCH,"2,782",10,4.3 out of 5 stars,06-Jan-16,(20% off),by Anthony Minessale II and Giovanni Maruzzelli | 6 January 2016
"R Bioinformatics Cookbook: Use R and Bioconductor to perform RNAseq, genomics, data visualization, and bioinformatic analysis","2,782",23,4.0 out of 5 stars,11-Oct-19,(20% off),by Dan MacLean | 11 October 2019
Azure Data Factory Cookbook: Build and manage ETL and ELT pipelines with Microsoft Azure's serverless data integration service,"2,782",26,4.2 out of 5 stars,24-Dec-20,(20% off),"by Dmitry Anoshin , Dmitry Foshin , et al. | 24 December 2020"
MASTERING AWS SECURITY (PB 2017): Create and maintain a secure cloud ecosystem,"2,273",32,3.7 out of 5 stars,01-Jan-17,(19% off),by ANTHONY A. | 1 January 2017
Serverless Architectures with Kubernetes: Create production-ready Kubernetes clusters and run serverless applications on them,"2,300",2,5.0 out of 5 stars,29-Nov-19,(26% off),by Onur Yılmaz and Sathsara Sarathchandra | 29 November 2019
"IoT and Edge Computing for Architects: Implementing edge and IoT systems from sensors to clouds with communication systems, analytics, and security, 2nd Edition","2,782",59,4.5 out of 5 stars,06-Mar-20,(20% off),by Perry Lea | 6 March 2020
Django By Example,"20,566",28,3.8 out of 5 stars,30-Nov-15,,by Antonio Mele | 30 November 2015
Professional Cloud Architect Google Cloud Certification Guide: Build a solid foundation in Google Cloud Platform to achieve the most lucrative IT certification,"2,782",29,4.5 out of 5 stars,23-Dec-21,(20% off),"by Konrad Clapa , Brian Gerrard , et al. | 23 December 2021"
Learning C# by Developing Games with Unity 3D Beginner's Guide,"3,100",56,3.9 out of 5 stars,25-Sep-13,(20% off),by Terry Norton | 25 September 2013
Hands-On Machine Learning for Cybersecurity: Safeguard your system by making your machines intelligent using the Python ecosystem,"2,782",18,3.9 out of 5 stars,31-Dec-18,(20% off),by Soma Halder and Sinan Ozdemir | 31 December 2018
"The The C++ Workshop: Learn to write clean, maintainable code in C++ and advance your career in software engineering","2,464",21,4.6 out of 5 stars,07-Feb-20,(20% off),"by Dale Green, Kurt Guntheroth, et al. | 7 February 2020"
Advanced Python Programming -: Accelerate your Python programs using proven techniques and design patterns,"3,100",10,4.1 out of 5 stars,25-Mar-22,(20% off),by Quan Nguyen | 25 March 2022
Microsoft 365 Security Administration: MS-500 Exam Guide: Plan and implement security and compliance strategies for Microsoft 365 and hybrid environments,"2,464",74,4.4 out of 5 stars,19-Jun-20,(20% off),by Peter Rising | 19 June 2020
"Software Architecture with C# 10 and .NET 6: Develop software solutions using microservices, DevOps, EF Core, and design patterns for Azure","3,100",20,4.1 out of 5 stars,15-Mar-22,(20% off),by Gabriel Baptista and Francesco Abbruzzese | 15 March 2022
"Learn Amazon SageMaker: A guide to building, training, and deploying machine learning models for developers and data scientists","2,782",8,4.4 out of 5 stars,26-Nov-21,(20% off),by Julien Simon | 26 November 2021
"CISSP (ISC) Certification Practice Exams and Tests: Over 1,000 practice questions and explanations covering all 8 CISSP domains for the May 2021 exam version","2,464",11,4.0 out of 5 stars,13-Sep-21,(20% off),by Ted Jordan | 13 September 2021
"Hands-On Cloud Administration in Azure: Implement, monitor, and manage important Azure services and components including IaaS and PaaS","2,782",48,4.2 out of 5 stars,23-Oct-18,(20% off),by Mustafa Toroman | 23 October 2018
"Mastering Microsoft Dynamics 365 Customer Engagement: An advanced guide to developing and customizing CRM solutions to improve your business applications, 2nd Edition","3,100",12,3.3 out of 5 stars,28-Feb-19,(20% off),by Deepesh Somani | 28 February 2019
Microsoft Exam MD-100 Windows 10 Certification Guide: Learn the skills required to become a Microsoft Certified Modern Desktop Administrator Associate,"2,464",31,4.2 out of 5 stars,22-May-20,(20% off),by Jeroen Burgerhout | 22 May 2020
"Node Cookbook: Discover solutions, techniques, and best practices for server-side web development with Node.js 14, 4th Edition","2,226",52,4.5 out of 5 stars,25-Nov-20,(20% off),by Bethany Griggs | 25 November 2020
Magento 2 Developer's Guide: Harness the power of Magento 2 to extend and customize your online store,"2,719",23,3.9 out of 5 stars,23-Dec-15,(15% off),by Branko Ajzele | 23 December 2015
Expert Microsoft Teams Solutions: A guide to Teams architecture and integration for advanced end-users and administrators,"2,782",2,5.0 out of 5 stars,18-Mar-22,(20% off),"by Aaron Guilmette , Yura Lee , et al. | 18 March 2022"
Expert Microsoft Teams Solutions: A guide to Teams architecture and integration for advanced end-users and administrators,"2,782",2,5.0 out of 5 stars,18-Mar-22,(20% off),"by Aaron Guilmette , Yura Lee , et al. | 18 March 2022"
Mastering Transformers: Build state-of-the-art models from scratch with advanced natural language processing techniques,"2,464",13,4.6 out of 5 stars,15-Sep-21,(20% off),by Savas Yildirim and Meysam Asgari-Chenaghlu | 15 September 2021
Mastering Python Data Analysis,"3,100",3,3.4 out of 5 stars,06-Jan-16,(20% off),by Magnus Vilhelm Persson and Luiz Felipe Martins | 6 January 2016
"Windows Server 2019 Automation with PowerShell Cookbook: Powerful ways to automate and manage Windows administrative tasks, 3rd Edition","1,995",52,4.7 out of 5 stars,28-Feb-19,(58% off),by Thomas Lee | 28 February 2019
"The The Data Science Workshop: Learn how you can build machine learning models and create your own real-world data science projects, 2nd Edition","2,464",11,4.9 out of 5 stars,28-Aug-20,(20% off),"by Anthony So, Thomas V. Joseph, et al. | 28 August 2020"
Splunk Operational Intelligence Cookbook,"3,100",12,4.0 out of 5 stars,31-Oct-14,(20% off),"by Josh Diakun, Paul R Johnson , et al. | 31 October 2014"
Mastering Embedded Linux Programming: Harness the power of Linux to create versatile and robust embedded solutions,"1,700",24,4.6 out of 5 stars,29-Dec-15,(51% off),by Chris Simmonds | 29 December 2015
Mastering Kali Linux for Advanced Penetration Testing,"3,418",12,4.2 out of 5 stars,24-Jun-14,(20% off),by Robert W. Beggs | 24 June 2014
Learn SQL Database Programming: Query and manipulate databases from popular relational database servers using SQL,"2,464",22,4.4 out of 5 stars,29-May-20,(20% off),by Josephine Bush | 29 May 2020
Enterprise Application Development with C# 9 and .NET 5: Enhance your C# and .NET skills by mastering the process of developing professional-grade web applications,"3,100",21,4.2 out of 5 stars,19-Mar-21,(20% off),"by Ravindra Akella , Arun Kumar Tamirisa , et al. | 19 March 2021"
"VMware vSphere 6.7 Data Center Design Cookbook: Over 100 practical recipes to help you design a powerful virtual infrastructure based on vSphere 6.7, 3rd Edition","3,736",19,4.6 out of 5 stars,28-Mar-19,(20% off),by Mike Brown and Hersey Cartwright | 28 March 2019
Selenium Web Driver Practical Guide,,33,3.9 out of 5 stars,24-Jan-14,,by Satya Avasarala | 24 January 2014
"Modern API Development with Spring and Spring Boot: Design highly scalable and maintainable APIs with REST, gRPC, GraphQL, and the reactive paradigm","2,782",8,4.0 out of 5 stars,25-Jun-21,(20% off),by Sourabh Sharma | 25 June 2021
"Kubernetes Cookbook: Practical solutions to container orchestration, 2nd Edition","2,464",6,4.5 out of 5 stars,30-May-18,(20% off),"by Hideto Saito , Hui-Chuan Chloe Lee, et al. | 30 May 2018"
Mastering Python,"2,466",14,3.6 out of 5 stars,06-Jan-16,(20% off),by Rick van Hattem | 6 January 2016
"Hands-On High Performance Programming with Qt 5: Build cross-platform applications using concurrency, parallel programming, and memory management","2,782",7,3.7 out of 5 stars,31-Jan-19,(20% off),by Marek Krajewski | 31 January 2019
