book_name,book_Price,book_reviews,book_rating,book_date,book_discount,book_author
Getting Started with Google BERT: Build and train state-of-the-art natural language processing models using BERT,"2,464",69,4.1 out of 5 stars,22-Jan-21,(20% off),by Sudharsan Ravichandiran | 22 January 2021
"AWS for Solutions Architects: Design your cloud infrastructure by implementing DevOps, containers, and Amazon Web Services","2,464",79,4.3 out of 5 stars,19-Feb-21,(20% off),by Alberto Artasanchez | 19 February 2021
"LEARNING AWS 2/ED: Design, build, and deploy responsive applications using AWS Cloud components, 2nd Edition","2,782",14,4.3 out of 5 stars,01-Jan-18,(20% off),by Amit Shah Aurobindo Sarkar | 1 January 2018
SQL for Data Analytics - Third Edition: Harness the power of SQL to extract insights from data,"2,703",1,5.0 out of 5 stars,29-Aug-22,(20% off),"by Jun Shan, Matt Goldwasser, et al. | 29 August 2022"
Programming with CodeIgniterMVC,"2,226",6,2.6 out of 5 stars,23-Sep-13,(20% off),by Eliahou Orr and Yehuda Zadik | 23 September 2013
Mastering Bootstrap 4,"2,782",3,3.3 out of 5 stars,06-Jan-16,(20% off),by Benjamin Jakobus and Jason Marah | 6 January 2016
"Learn Python Programming: An in-depth introduction to the fundamentals of Python, 3rd Edition","2,703",29,4.1 out of 5 stars,29-Oct-21,(20% off),by Fabrizio Romano and Heinrich Kruger | 29 October 2021
"Artificial Intelligence By Example: Acquire advanced AI, machine learning, and deep learning design skills, 2nd Edition","2,464",16,4.2 out of 5 stars,28-Feb-20,(20% off),by Denis Rothman | 28 February 2020
"Exam Ref AZ-104 Microsoft Azure Administrator Certification and Beyond: A pragmatic guide to achieving the Azure administration certification, 2nd ... achieving Azure administration certification","3,578",,,22-Jul-22,(20% off),by Donovan Kelly and Riaan Lowe | 22 July 2022
"GitHub Essentials: Unleash the power of collaborative development workflows using GitHub, 2nd Edition","1,828",14,3.7 out of 5 stars,30-Jun-18,(20% off),by Achilleas Pipinellis | 30 June 2018
"Machine Learning on Kubernetes: Build, deploy, and track your ML models on a containerized, sustainable machine learning platform","2,703",,,17-Jun-22,(20% off),by Faisal Masood and Ross Brigoli | 17 June 2022
Mastering Microsoft Power Bi: Expert techniques for effective data analytics and business intelligence,"3,100",156,4.2 out of 5 stars,01-Jan-18,(20% off),by Brett Powell | 1 January 2018
Mastering ROS for Robotics Programming: Best practices and troubleshooting solutions when working with ROS,"3,418",16,4.6 out of 5 stars,28-Oct-21,(20% off),by Lentin Joseph and Jonathan Cacace | 28 October 2021
"Mastering Machine Learning with R -: Advanced prediction, algorithms, and learning methods with R 3.x",898,5,3.2 out of 5 stars,24-Apr-17,(77% off),by Cory Lesmeister | 24 April 2017
Python for Geeks: Build production-ready applications using advanced Python concepts and industry best practices,"2,464",11,4.2 out of 5 stars,20-Oct-21,(20% off),by Muhammad Asif | 20 October 2021
Python Algorithmic Trading Cookbook: All the recipes you need to implement your own algorithmic trading strategies in Python,"2,853",29,3.9 out of 5 stars,28-Aug-20,(18% off),by Pushpak Dagade | 28 August 2020
MuleSoft for Salesforce Developers: A practitioner's guide to deploy MuleSoft APIs and integrations for Salesforce enterprise solutions: A ... for Salesforce enterprise solutions,"2,943",,,23-Sep-22,(20% off),"by Akshata Sawant , Arul Christhuraj Alphonse , et al. | 23 September 2022"
Workflow Automation with Microsoft Power Automate -: Use business process automation to achieve digital transformation with minimal code,"2,385",7,4.6 out of 5 stars,19-Aug-22,(20% off),by Aaron Guilmette | 19 August 2022
Django 4 By Example - Fourth Edition: Build powerful and reliable Python web applications from scratch,"2,941",6,4.6 out of 5 stars,30-Aug-22,(20% off),by Antonio Mele | 30 August 2022
Artificial Intelligence with Power BI: Take your data analytics skills to the next level by leveraging the AI capabilities in Power BI,"2,782",3,4.2 out of 5 stars,29-Apr-22,(20% off),by Mary-Jo Diepeveen | 29 April 2022
Mastering Mobile Forensics,"2,782",5,5.0 out of 5 stars,06-Jan-16,(20% off),by Soufiane Tahiri | 6 January 2016
"Deciphering Object-Oriented Programming with C++: A practical, in-depth guide to implementing object-oriented design principles to create robust code","2,703",,,23-Sep-22,(20% off),by Dorothy R. Kirk | 23 September 2022
"Software Architecture with Python: Design and architect highly scalable, robust, clean, and high performance applications in Python","1,100",12,4.1 out of 5 stars,28-Apr-17,(50% off),by Anand Balachandran Pillai | 28 April 2017
"C++ High Performance: Master the art of optimizing the functioning of your C++ code, 2nd Edition","3,418",94,4.6 out of 5 stars,30-Dec-20,(20% off),"by Björn Andrist, Viktor Sehr, et al. | 30 December 2020"
Cryptography and Network Security - Principles and Practice | Seventh Edition | By Pearson,706,416,4.4 out of 5 stars,30-Jun-17,"Buy 2 get 5% off, Buy 3 + & get 10% off
Buy 2 get 5% off, Buy 3 + & get 10% off",by Stallings William | 30 June 2017
"Mastering Ubuntu Server - Fourth Edition: Explore the versatile, powerful Linux Server distribution Ubuntu 22.04 with this comprehensive guide","2,941",,,04-Aug-22,(20% off),by Jay LaCroix | 4 August 2022
Learn Quantum Computing with Python and IBM Quantum Experience: A hands-on introduction to quantum computing and writing your own quantum programs with Python,"2,464",87,4.4 out of 5 stars,28-Sep-20,(20% off),by Robert Loredo | 28 September 2020
Artificial Intelligence | Third Edition | By Pearson: A Modern Approach,704,"1,572",4.4 out of 5 stars,01-Jan-15,(26% off),by Russell | 1 January 2015
"Selenium WebDriver 3 Practical Guide: End-to-end automation testing for web and mobile browsers with Selenium WebDriver, 2nd Edition","2,464",19,4.4 out of 5 stars,31-Jul-18,(20% off),by Unmesh Gundecha and Satya Avasarala | 31 July 2018
Demystifying Ansible Automation Controller: The definitive way to manage Ansible Automation Controller and Ansible Tower,"2,386",,,21-Oct-22,(20% off),by Sean Sullivan | 21 October 2022
"Digital Design | With an Introduction to the Verilog HDL, VHDL, and SystemVerilog | Sixth Edition | By Pearson",615,598,4.6 out of 5 stars,18-May-18,(18% off),by M. Morris Mano and Michael D. Ciletti | 18 May 2018
Ansible for Real Life Automation: A complete Ansible handbook filled with real life IT automation use cases,"2,943",,,30-Sep-22,(20% off),by Gineesh Madapparambath | 30 September 2022
Microsoft SharePoint 2010 Developer’s Compendium: The Best of Packt for Extending SharePoint,"3,100",,,22-Feb-12,(20% off),"by Yaroslav Pentsarskyy, Balaji Kithiganahalli , et al. | 22 February 2012"
Mastering SaltStack -: Use Salt to the fullest,"3,102",11,4.2 out of 5 stars,06-Dec-16,(20% off),by Joseph Hall | 6 December 2016
Responsive Web Design with HTML5 and CSS - Fourth Edition: Build future-proof responsive websites using the latest HTML5 and CSS techniques,"5,009",1,5.0 out of 5 stars,19-Sep-22,"10% Off on SBI Cards
10% Off on SBI Cards",by Ben Frain | 19 September 2022
Managing Data and Media in Silverlight 4: A mashup of chapters from Packt's bestselling Silverlight books,"2,464",,,24-Feb-12,(20% off),"by Gaston C. Hillar, Gill Cleeren, et al. | 24 February 2012"
Low-Code Application Development with Appian: A beginner's guide to high-speed business innovation at enterprise scale using Appian,"2,464",4,4.3 out of 5 stars,09-Jun-22,(20% off),by Stefan Helzle | 9 June 2022
The The Java Workshop: Learn object-oriented programming and kickstart your career in software development,"2,464",11,3.5 out of 5 stars,31-Oct-19,(20% off),"by David Cuartielles, Andreas Göransson , et al. | 31 October 2019"
"Azure for Developers -: Implementing rich Azure PaaS ecosystems using containers, serverless services and storage solutions","2,941",,,16-Sep-22,(20% off),by Kamil Mrzyglod | 16 September 2022
"Modern C++ Programming Cookbook: Master C++ core language and standard library features, with over 100 recipes, updated to C++20, 2nd Edition","3,100",76,4.3 out of 5 stars,11-Sep-20,(20% off),by Marius Bancila | 11 September 2020
Mobile Forensics Cookbook,"2,464",5,3.4 out of 5 stars,15-Dec-17,(20% off),by Igor Mikhaylov | 15 December 2017
"Microsoft Security, Compliance, and Identity Fundamentals Exam Ref SC-900: Learn all about security, identity, and compliance in Microsoft 365 and Azure to pass the SC-900 exam","2,385",,,10-Jun-22,(20% off),by Dwayne Natwick | 10 June 2022
"Learning RSLogix 5000 Programming: Build robust PLC solutions with ControlLogix, CompactLogix, and Studio 5000/RSLogix 5000, 2nd Edition","2,464",59,4.3 out of 5 stars,06-Jul-20,(20% off),by Austin Scott | 6 July 2020
LLVM Essentials,"1,510",17,3.0 out of 5 stars,21-Dec-15,(20% off),by Suyog Sarda and Mayur Pandey | 21 December 2015
Data Structures And Algorithms Made Easy: Data Structures And Algorithmic Puzzles,538,"2,130",4.4 out of 5 stars,01-Jan-16,(17% off),by Narasimha Karumanchi | 1 January 2016
OpenStack Essentials -,500,6,3.3 out of 5 stars,06-Jan-16,(23% off),by Dan Radez | 6 January 2016
Microsoft Azure IaaS Essentials,"1,510",1,5.0 out of 5 stars,28-May-15,(20% off),by Gethyn Ellis | 28 May 2015
"The The Supervised Learning Workshop: A New, Interactive Approach to Understanding Supervised Learning Algorithms, 2nd Edition","2,226",8,4.5 out of 5 stars,28-Feb-20,(20% off),"by Blaine Bateman , Ashish Ranjan Jha , et al. | 28 February 2020"
Hands-On Metaprogramming with Python 3: A programmer's guide to writing reusable code to build smarter applications,"4,040",,,23-Sep-22,(20% off),by Sulekha AloorRavi | 23 September 2022
Microsoft Power BI Data Analyst Certification Guide: A comprehensive guide to becoming a confident and certified Power BI professional,"2,703",7,4.8 out of 5 stars,24-Jun-22,(20% off),by Orrin Edenfield and Edward Corcoran | 24 June 2022
Azure Data Scientist Associate Certification Guide: A hands-on guide to machine learning in Azure and passing the Microsoft Certified DP-100 exam,554,5,4.3 out of 5 stars,03-Dec-21,(44% off),by Andreas Botsikas and Michael Hlobil | 3 December 2021
Java for Data Science,"3,100",1,5.0 out of 5 stars,10-Jan-17,(20% off),by Richard M. Reese and Jennifer L. Reese | 10 January 2017
Elasticsearch Indexing,"1,510",,,30-Dec-15,(20% off),by Huseyin Akdogan | 30 December 2015
Building Machine Learning Systems with Python,704,32,4.1 out of 5 stars,26-Jul-13,(53% off),by Willi Richert and Luis Pedro Coelho | 26 July 2013
Solutions Architect's Handbook: Kick-start your career as a solutions architect by learning architecture design principles and strategies,"3,100",114,4.6 out of 5 stars,17-Jan-22,(20% off),"by Saurabh Shrivastava , Neelanjali Srivastav , et al. | 17 January 2022"
Implementing Citrix XenServer Quickstarter,"2,226",,,18-Jun-13,(20% off),by Gohar Ahmed | 18 June 2013
Secret Recipes of the Python Ninja: Over 70 recipes that uncover powerful programming tactics in Python,"3,100",1,5.0 out of 5 stars,21-May-18,(20% off),by Steven F. Lott and Cody Jackson | 21 May 2018
Learn LLVM 12: A beginner's guide to learning LLVM compiler tools and core libraries with C++,"2,782",12,4.1 out of 5 stars,28-May-21,(20% off),by Kai Nacke | 28 May 2021
The Ultimate Guide to Google Cloud Foundation: A one-on-one tutorial with one of Google's top trainers,"2,704",,,19-Aug-22,(20% off),by Patrick Haggerty | 19 August 2022
Ein Profi packt aus!: Das kulinarische Jahr,"2,479",,,29-Jun-22,(9% off),German Edition | by Benjamin Weidemann | 29 June 2022
"Mastering Microsoft Endpoint Manager: Deploy and manage Windows 10, Windows 11, and Windows 365 on both physical and cloud PCs","3,102",88,4.7 out of 5 stars,07-Oct-21,(20% off),"by Christiaan Brinkhoff , Per Larsen , et al. | 7 October 2021"
OpenCV Android Programming By Example,"1,828",,,15-Dec-15,(20% off),by Amgad Muhammad | 15 December 2015
"Build Your Own Programming Language: A programmer's guide to designing compilers, interpreters, and DSLs for solving modern computing problems","2,782",23,4.3 out of 5 stars,31-Dec-21,(20% off),by Clinton L. Jeffery | 31 December 2021
"C# 10 and .NET 6 – Modern Cross-Platform Development: Build apps, websites, and services with ASP.NET Core 6, Blazor, and EF Core 6 using Visual Studio 2022 and Visual Studio Code","3,100",277,4.6 out of 5 stars,09-Nov-21,(20% off),by Mark J. Price | 9 November 2021
"Python Automation Cookbook: 75 Python automation ideas for web scraping, data wrangling, and processing Excel, reports, emails, and more, 2nd Edition","2,464",67,4.3 out of 5 stars,29-May-20,(20% off),by Jaime Buelta | 29 May 2020
"Python Machine Learning: Machine Learning and Deep Learning with Python, scikit-learn, and TensorFlow 2, 3rd Edition","3,100",367,4.5 out of 5 stars,12-Dec-19,(20% off),by Sebastian Raschka and Vahid Mirjalili | 12 December 2019
Machine Learning Algorithms: A reference guide to popular algorithms for data science and machine learning,"3,171",11,4.3 out of 5 stars,24-Jul-17,(19% off),by Giuseppe Bonaccorso | 24 July 2017
Mastering Swift 4 - Fourth Edition: An in-depth and comprehensive guide to modern programming techniques with Swift,"2,150",27,4.0 out of 5 stars,27-Sep-17,(33% off),by Jon Hoffman | 27 September 2017
Linux for Networking Professionals: Securely configure and operate Linux network services for the enterprise,"2,853",9,4.7 out of 5 stars,11-Nov-21,(18% off),by Rob VandenBrink | 11 November 2021
CodeIgniter Web Application Blueprints,"2,782",7,3.7 out of 5 stars,21-Jan-15,(20% off),by Rob Foster | 21 January 2015
"Learning JavaScript Data Structures and Algorithms: Write complex and powerful JavaScript code using the latest ECMAScript, 3rd Edition","2,784",16,4.2 out of 5 stars,30-Apr-18,(20% off),by Loiane Groner | 30 April 2018
Responsive Web Design with Html5 and Css3,"2,200",112,4.2 out of 5 stars,01-Jan-12,(29% off),by Ben Frain | 1 January 2012
AWS Certified Database - Specialty (DBS-C01) Certification: A comprehensive guide to becoming an AWS Certified Database Specialist,"2,943",7,4.4 out of 5 stars,09-Jun-22,(20% off),by Kate Gawron | 9 June 2022
"Practical Automated Machine Learning using H2O.ai: Discover the power of automated machine learning, from experimentation to deployment in production","2,385",,,26-Sep-22,(20% off),by Salil Ajgaonkar | 26 September 2022
Machine Learning with PyTorch and Scikit-Learn: Develop machine learning and deep learning models with Python,"3,100",110,4.6 out of 5 stars,25-Feb-22,(20% off),"by Sebastian Raschka , Yuxi (Hayden) Liu , et al. | 25 February 2022"
"CMake Cookbook: Building, testing, and packaging modular software with modern CMake","3,418",31,4.3 out of 5 stars,26-Sep-18,"10% Off on SBI Cards
10% Off on SBI Cards",by Radovan Bast and Roberto Di Remigio | 26 September 2018
"Learning OpenCV 4 Computer Vision with Python 3: Get to grips with tools, techniques, and algorithms for computer vision and machine learning, 3rd Edition","2,226",82,4.3 out of 5 stars,20-Feb-20,(20% off),by Joseph Howse and Joe Minichino | 20 February 2020
Mastering JavaScript Object-Oriented Programming,"2,782",6,4.4 out of 5 stars,06-Jan-16,(20% off),by Andrea Chiarelli | 6 January 2016
Automated Machine Learning with Microsoft Azure: Build highly accurate and scalable end-to-end AI solutions with Azure AutoML,"2,782",9,4.5 out of 5 stars,23-Apr-21,(20% off),by Dennis Michael Sawyers | 23 April 2021
Modern Programming: Object Oriented Programming and Best Practices: Deconstruct object-oriented programming and use it with other programming paradigms to build applications,"2,226",4,4.4 out of 5 stars,28-Jun-19,(20% off),by Graham Lee | 28 June 2019
TypeScript 4 Design Patterns and Best Practices: Discover effective techniques and design patterns for every programming task,"2,782",9,4.1 out of 5 stars,15-Sep-21,(20% off),by Theo Despoudis | 15 September 2021
Mastering Embedded Linux Programming -: Unleash the full potential of Embedded Linux with Linux 4.9 and Yocto Project 2.2 (Morty) Updates,"3,101",47,4.3 out of 5 stars,30-Jun-17,(20% off),by Chris Simmonds | 30 June 2017
Java EE 8 Cookbook: Build reliable applications with the most robust and mature technology for enterprise development,"2,500",5,3.3 out of 5 stars,09-Apr-18,(36% off),by Elder Moraes | 9 April 2018
Learn Ethereum: Build your own decentralized applications with Ethereum and smart contracts,"2,226",50,4.3 out of 5 stars,20-Sep-19,(20% off),"by Xun (Brian) Wu , Zhihong Zou , et al. | 20 September 2019"
"Machine Learning for Time-Series with Python: Forecast, predict, and detect anomalies with state-of-the-art machine learning methods","2,941",25,4.0 out of 5 stars,29-Oct-21,(20% off),by Ben Auffarth | 29 October 2021
Statistics for Data Science,"2,465",9,4.0 out of 5 stars,17-Nov-17,(20% off),by James D. Miller | 17 November 2017
Mastering Linux Device Driver Development: Write custom device drivers to support computer peripherals in Linux operating systems,"2,782",19,4.8 out of 5 stars,08-Jan-21,(20% off),by John Madieu | 8 January 2021
MobX Quick Start Guide: Supercharge the client state in your React apps with MobX,"1,828",12,4.3 out of 5 stars,26-Jul-18,(20% off),by Pavan Podila and Michel Weststrate | 26 July 2018
Apache Spark Deep Learning Cookbook: Over 80 recipes that streamline deep learning in a distributed environment with Apache Spark,"2,999",1,5.0 out of 5 stars,13-Jul-18,(23% off),by Ahmed Sherif and Amrith Ravindra | 13 July 2018
Lean Mobile App Development,"2,464",6,4.1 out of 5 stars,28-Nov-17,(20% off),"by Mike van Drongelen, Adam Dennis, et al. | 28 November 2017"
Phoenix Web Development: Create rich web applications using functional programming techniques with Phoenix and Elixir,"2,465",1,3.0 out of 5 stars,30-Apr-18,(20% off),by Mike Voloz and Brandon Richey | 30 April 2018
"Engineering MLOps: Rapidly build, test, and manage production-ready machine learning life cycles at scale","2,782",20,3.8 out of 5 stars,19-Apr-21,(20% off),by Emmanuel Raj | 19 April 2021
"Hands-On Serverless Computing with Google Cloud: Build, deploy, and containerize apps using Cloud Functions, Cloud Run, and cloud-native technologies","3,102",6,4.3 out of 5 stars,14-Feb-20,(20% off),by Richard Rose | 14 February 2020
The The Art of CRM: Proven strategies for modern customer relationship management,"2,464",14,3.8 out of 5 stars,22-May-19,(20% off),by Max Fatouretchi | 22 May 2019
Mastering Metasploit,"3,100",14,4.4 out of 5 stars,26-May-14,(20% off),by Nipun Jaswal | 26 May 2014
Computer Programming for Absolute Beginners: Learn essential computer science concepts and coding techniques to kick-start your programming career,"2,226",70,4.3 out of 5 stars,31-Jul-20,(20% off),by Joakim Wassberg | 31 July 2020
"React 17 Design Patterns and Best Practices: Design, build, and deploy production-ready web applications using industry-standard practices, 3rd Edition","2,464",29,4.3 out of 5 stars,17-May-21,(20% off),by Carlos Santana Roldán | 17 May 2021
"Learning C# by Developing Games with Unity 2020: An enjoyable and intuitive approach to getting started with C# programming and Unity, 5th Edition","2,499",303,4.6 out of 5 stars,21-Aug-20,(52% off),by Harrison Ferrone | 21 August 2020
Designing Hexagonal Architecture with Java: An architect's guide to building maintainable and change-tolerant applications with Java and Quarkus,"2,466",13,4.8 out of 5 stars,07-Jan-22,(20% off),by Davi Vieira | 7 January 2022
Data Analytics Made Easy: Analyze and present data to make informed decisions without writing any code,"1,828",20,4.8 out of 5 stars,30-Aug-21,(20% off),"by Andrea De Mauro , Francesco Marzoni, et al. | 30 August 2021"
Hands-On Embedded Programming with C++17: Create versatile and robust embedded solutions for MCUs and RTOSes with modern C++,"2,782",13,3.9 out of 5 stars,31-Jan-19,(20% off),by Maya Posch | 31 January 2019
Microsoft Dynamics AX 2012 R3 Reporting Cookbook,"3,736",3,4.0 out of 5 stars,27-Mar-15,(20% off),"by Deepak Agarwal, Chhavi Aggarwal, et al. | 27 March 2015"
"Professional Azure SQL Database Administration: Equip yourself with the skills to manage and maintain data in the cloud, 2nd Edition","2,782",18,4.1 out of 5 stars,19-Jul-19,(20% off),by Ahmad Osama | 19 July 2019
Software-Defined Networking with OpenFlow -,"2,465",1,5.0 out of 5 stars,25-Oct-17,(20% off),by Oswald Coker and Siamak Azodolmolky | 25 October 2017
Mastering Python for Data Science,"3,736",15,3.8 out of 5 stars,01-Jan-15,(20% off),by Samir Madhavan Samir | 1 January 2015
"Data Science Projects with Python: A case study approach to gaining valuable insights from real data with machine learning, 2nd Edition","2,226",19,4.3 out of 5 stars,29-Jul-21,(20% off),by Stephen Klosterman | 29 July 2021
Learn Selenium: Build data-driven test frameworks for mobile and web applications with Selenium Web Driver 3,"3,100",12,4.4 out of 5 stars,18-Jul-19,(20% off),by Unmesh Gundecha and Carl Cocchiaro | 18 July 2019
"System Center 2016 Virtual Machine Manager Cookbook,: Design, configure, and manage an efficient virtual infrastructure with VMM in System Center 2016, 3rd Edition","3,100",5,3.7 out of 5 stars,21-Feb-18,(20% off),by EDVALDO ALESSANDRO CARDOSO and Roman Levchenko | 21 February 2018
Automata Theory Language & Computation | Third Edition | By Pearson,599,315,4.3 out of 5 stars,01-Jan-08,"Buy 2 get 5% off, Buy 3 + & get 10% off
Buy 2 get 5% off, Buy 3 + & get 10% off",by Hopcroft | 1 January 2008
Time Series Analysis with Python Cookbook: Over 75 practical recipes to develop your time series analysis and forecasting skills,"2,941",2,4.5 out of 5 stars,01-Jul-22,(20% off),by Tarek Atwan | 1 July 2022
Neo4j High Performance,"1,828",2,3.0 out of 5 stars,02-Mar-15,(20% off),by Sonal Raj | 2 March 2015
"Hands-On Data Analysis with Pandas: A Python data science handbook for data collection, wrangling, analysis, and visualization, 2nd Edition","2,464",61,4.3 out of 5 stars,29-Apr-21,(20% off),by Stefanie Molin and Ken Jee | 29 April 2021
"Practical Network Automation: A beginner's guide to automating and optimizing networks using Python, Ansible, and more, 2nd Edition","2,464",14,3.8 out of 5 stars,26-Dec-18,(20% off),by Abhishek Ratan | 26 December 2018
Learn C Programming -: A beginner's guide to learning the most powerful and general-purpose programming language with ease,"2,385",,,10-Jun-22,(20% off),by Jeff Szuhay | 10 June 2022
Performance Testing With JMeter 2.9,"2,464",8,3.1 out of 5 stars,26-Jul-13,(20% off),by Bayo Erinle | 26 July 2013
"Hands-On Web Scraping with Python: Perform advanced scraping operations using various Python libraries and tools such as Selenium, Regex, and others","2,226",27,4.0 out of 5 stars,15-Jul-19,(20% off),by Anish Chapagain | 15 July 2019
"React and React Native - Fourth Edition: Build cross-platform JavaScript applications with native power for the web, desktop, and mobile","2,386",6,4.1 out of 5 stars,27-May-22,(20% off),"by Adam Boduch , Roy Derks, et al. | 27 May 2022"
Learn React with TypeScript 3: Beginner's guide to modern React web development with TypeScript 3,"2,782",29,4.2 out of 5 stars,29-Nov-18,(20% off),by Carl Rippon | 29 November 2018
Packt die Badehosen ein!: Vier Bären-Abenteuer im Sommer,"1,301",,,03-Feb-22,(9% off),German Edition | by Ilona Giesen and Carola Mehring | 3 February 2022
"Hands-On Machine Learning with Microsoft Excel 2019: Build complete data analysis flows, from data collection to visualization","2,464",30,4.4 out of 5 stars,30-Apr-19,(20% off),by Julio Cesar Rodriguez Martino | 30 April 2019
"Clean Code in JavaScript: Develop reliable, maintainable, and robust JavaScript","2,226",33,4.5 out of 5 stars,20-Jan-20,(20% off),by James Padolsey | 20 January 2020
Workflow Automation with Microsoft Power Automate: Achieve digital transformation through business automation with minimal coding,"3,341",132,4.3 out of 5 stars,18-Sep-20,(20% off),by Aaron Guilmette | 18 September 2020
Mastering IOT: Build modern IoT solutions that secure and monitor your IoT infrastructure,"3,100",6,4.2 out of 5 stars,16-Apr-19,(20% off),by Colin Dow and Perry Lea | 16 April 2019
101 UX Principles: A definitive design guide,"3,984",49,4.3 out of 5 stars,31-Aug-18,(15% off),by Will Grant | 31 August 2018
Data Visualization: a successful design process,"1,828",19,3.9 out of 5 stars,26-Dec-12,(20% off),by Andy Kirk | 26 December 2012
Arduino for Kids: A cool guide to help kids develop robots and electronics,"2,226",8,3.7 out of 5 stars,23-Mar-17,(20% off),"by Priya Kuber, Rishi Gaurav Bhatnagar, et al. | 23 March 2017"
Kubernetes in Production Best Practices: Build and manage highly available production-ready Kubernetes clusters,"2,296",18,4.7 out of 5 stars,12-Feb-21,(18% off),by Aly Saleh and Murat Karslioglu | 12 February 2021
Image Processing with ImageJ,"1,828",8,3.4 out of 5 stars,23-Sep-13,(20% off),by Jose Maria MateosPerez and Javier Pascau | 23 September 2013
WiX 3.6: A Developer's Guide to Windows Installer XML,"2,970",42,4.2 out of 5 stars,17-Dec-12,(24% off),by Nick Ramirez | 17 December 2012
NumPy Essentials,"1,828",4,4.0 out of 5 stars,06-Jan-16,(20% off),by Leo (Liang-Huan) Chin and Tanmay Dutta | 6 January 2016
Serverless ETL and Analytics with AWS Glue: Your first one-stop reference guide on AWS Glue and its features,"2,943",1,5.0 out of 5 stars,02-Sep-22,(20% off),"by Vishal Pathak , Subramanya Vajiraya , et al. | 2 September 2022"
PHP 7 Programming Cookbook: Over 80 recipes that will take your PHP 7 web development skills to the next level!,"3,100",11,4.3 out of 5 stars,06-Jan-16,(20% off),by Doug Bierer | 6 January 2016
