book_name,book_Price,book_reviews,book_rating,book_date,book_discount,book_author
AWS Lambda Quick Start Guide: Learn how to build and deploy serverless applications on AWS,"1,828",6,4.6 out of 5 stars,29-Jun-18,(20% off),by Markus Klems | 29 June 2018
"Scaling Scrum Across Modern Enterprises: Implement Scrum and Lean-Agile techniques across complex products, portfolios, and programs in large organizations","3,100",6,4.6 out of 5 stars,31-Aug-20,(20% off),by Cecil Rupp and Manjit Singh | 31 August 2020
Learning Linux Binary Analysis,"2,600",27,4.4 out of 5 stars,06-Jan-16,(26% off),"by Ryan ""elfmaster"" O'Neill | 6 January 2016"
Apache Spark 2.x for Java Developers,"3,100",8,2.8 out of 5 stars,26-Jul-17,(20% off),by Sourav Gulati and Sumit Kumar | 26 July 2017
Machine Learning With R,"2,809",93,4.3 out of 5 stars,25-Oct-13,(30% off),by Brett Lantz | 25 October 2013
Python Image Processing Cookbook: Over 60 recipes to help you perform complex image processing and computer vision tasks with ease,"2,782",11,4.3 out of 5 stars,17-Apr-20,(20% off),by Sandipan Dey | 17 April 2020
"Hands-On Explainable AI (XAI) with Python: Interpret, visualize, explain, and integrate reliable AI for fair, secure, and trustworthy AI apps","3,100",13,3.7 out of 5 stars,31-Jul-20,(20% off),by Denis Rothman | 31 July 2020
Hands-On Generative Adversarial Networks with PyTorch 1.x: Implement next-generation neural networks to build powerful GAN models using Python,"2,464",10,4.7 out of 5 stars,12-Dec-19,(20% off),by John Hany and Greg Walters | 12 December 2019
"Managing and Visualizing Your BIM Data: Understand the fundamentals of computer science for data visualization using Autodesk Dynamo, Revit, and Microsoft Power BI","3,320",15,4.9 out of 5 stars,25-Nov-21,(23% off),"by Ernesto Pellegrino , Manuel Andre Bottiglieri, et al. | 25 November 2021"
Beginning React: Simplify your frontend development workflow and enhance the user experience of your applications with React,954,2,3.0 out of 5 stars,25-Jul-18,(20% off),by Andrea Chiarelli | 25 July 2018
"Forecasting Time Series Data with Facebook Prophet: Build, improve, and optimize time series forecasting models using the advanced forecasting tool","2,782",26,4.7 out of 5 stars,12-Mar-21,(20% off),by Greg Rafferty | 12 March 2021
Linux Device Driver Development Cookbook: Develop custom drivers for your embedded Linux applications,"2,464",10,4.1 out of 5 stars,31-May-19,(20% off),by Rodolfo Giometti | 31 May 2019
Performance Testing with JMeter 3 - Third Edition,"2,226",5,4.4 out of 5 stars,21-Jul-17,(20% off),by Bayo Erinle | 21 July 2017
"Selenium WebDriver Quick Start Guide: Write clear, readable, and reliable tests with Selenium WebDriver 3","1,828",21,4.5 out of 5 stars,30-Oct-18,(20% off),by Pinakin Chaubal | 30 October 2018
"Scala and Spark for Big Data Analytics: Explore the concepts of functional programming, data streaming, and machine learning","4,054",14,2.5 out of 5 stars,25-Jul-17,(20% off),by Md. Rezaul Karim and Sridhar Alla | 25 July 2017
Ein Fahrlehrer packt richtig aus!: Über die Gefahren im Straßenverkehr und wie wir alle besser werden können,"1,332",3,4.0 out of 5 stars,10-Dec-15,(10% off),German Edition | by Jörg Holtmann | 10 December 2015
"PHP Web 2.0 Mashup Projects: Practical PHP Mashups with Google Maps, Flickr, Amazon, YouTube, MSN Search, Yahoo!","2,195",1,4.0 out of 5 stars,15-Dec-10,(29% off),by Shu-Wai Chow | 15 December 2010
Learn Red – Fundamentals of Red: Get up and running with the Red language for full-stack development,"1,700",2,5.0 out of 5 stars,18-May-18,(39% off),by Ivo Balbaert | 18 May 2018
Getting Started with React Native,"1,800",2,3.5 out of 5 stars,18-Dec-15,(22% off),by Ethan Holmes and Tom Bray | 18 December 2015
NHibernate 4.x Cookbook -,"2,429",2,4.5 out of 5 stars,31-Jan-17,(38% off),"by Gunnar Liljas, Alexander Zaytsev, et al. | 31 January 2017"
Backbone.js Blueprints,"5,999",3,3.5 out of 5 stars,20-May-14,10% Off on SBI Cards,by Andrew Burgess | 20 May 2014
Internet of Things Programming Projects: Build modern IoT solutions with the Raspberry Pi 3 and Python,"2,395",16,4.5 out of 5 stars,31-Oct-18,(23% off),by Colin Dow | 31 October 2018
"kubectl: Command-Line Kubernetes in a Nutshell: Deploy, manage, and debug container workloads using the Kubernetes CLI","1,510",20,4.2 out of 5 stars,20-Nov-20,(20% off),by Rimantas Mocevicius | 20 November 2020
"Pocket CIO – The Guide to Successful IT Asset Management: Get to grips with the fundamentals of IT Asset Management, Software Asset Management, and Software License Compliance Audits with this guide","2,535",14,4.5 out of 5 stars,30-Mar-18,(18% off),by Phara McLachlan | 30 March 2018
"The The Complete Rust Programming Reference Guide: Design, develop, and deploy effective software systems using the advanced constructs of Rust","3,100",38,4.5 out of 5 stars,22-May-19,(20% off),"by Rahul Sharma, Vesa Kaihlavirta, et al. | 22 May 2019"
Data Democratization with Domo: Bring together every component of your business to make better data-driven decisions using Domo,"2,941",1,4.0 out of 5 stars,09-Aug-22,(20% off),by Jeff Burtenshaw | 9 August 2022
JBoss: Developer's Guide,"2,782",2,4.5 out of 5 stars,31-Aug-17,(20% off),by Elvadas Nono Woguia | 31 August 2017
C# Data Structures and Algorithms: Explore the possibilities of C# for developing a variety of efficient applications,"3,100",31,4.5 out of 5 stars,19-Apr-18,(20% off),by Marcin Jamro | 19 April 2018
The DevOps 2.3 Toolkit,"2,719",5,4.7 out of 5 stars,13-Sep-18,(15% off),by Viktor Farcic | 13 September 2018
"Learning RxJava: Build concurrent applications using reactive programming with the latest features of RxJava 3, 2nd Edition","2,226",20,4.7 out of 5 stars,28-Feb-20,(20% off),by Nick Samoylov and Thomas Nield | 28 February 2020
Mastering Kubernetes: Large scale container deployment and management,"3,100",10,3.6 out of 5 stars,25-May-17,(20% off),by Gigi Sayfan | 25 May 2017
Software-Defined Networking (SDN) with OpenStack,"2,782",5,3.3 out of 5 stars,28-Oct-16,(20% off),by Sriram Subramanian and Sreenivas Voruganti | 28 October 2016
Cross-Platform Development with Qt 6 and Modern C++: Design and build applications with modern graphical user interfaces without worrying about platform dependency,"3,100",21,4.1 out of 5 stars,25-Jun-21,(20% off),by Nibedit Dey | 25 June 2021
"Understanding Software: Max Kanat-Alexander on simplicity, coding, and how to suck less as a programmer","1,828",12,4.0 out of 5 stars,29-Sep-17,(20% off),by Max Kanat-Alexander | 29 September 2017
Test-Driven Java Development: Invoke TDD principles for end-to-end application development with Java,"3,100",12,3.7 out of 5 stars,27-Aug-15,(20% off),by Viktor Farcic and Alex Garcia | 27 August 2015
C++ High Performance: Boost and optimize the performance of your C++17 code,"2,700",48,4.2 out of 5 stars,31-Jan-18,(23% off),by Björn Andrist and Viktor Sehr | 31 January 2018
Hands-On MQTT Programming with Python: Work with the lightweight IoT protocol in Python,"1,650",5,3.2 out of 5 stars,22-May-18,(41% off),by Gaston C. Hillar | 22 May 2018
Raspberry Pi for Python Programmers Cookbook -,"1,939",5,4.5 out of 5 stars,06-Oct-16,(45% off),by Tim Cox | 6 October 2016
D Cookbook,"2,499",5,5.0 out of 5 stars,26-May-14,(36% off),by Adam D. Ruppe | 26 May 2014
"Learning Python for Forensics: Learn the art of designing, developing, and deploying innovative forensic solutions through Python","2,800",5,4.3 out of 5 stars,06-Jan-16,(40% off),by Preston Miller and Chapin Bryce | 6 January 2016
Learn OpenGL: Beginner's guide to 3D rendering and game development with OpenGL and C++,"1,829",14,4.0 out of 5 stars,31-Aug-18,(20% off),by Frahaan Hussain | 31 August 2018
Mastering Python for Finance: Design and implement state-of-the-art mathematical and statistical applications used in finance,"1,663",10,3.8 out of 5 stars,29-Apr-15,(57% off),by James Ma Weiming | 29 April 2015
Supercharge Your Applications with GraalVM: Hands-on examples to optimize and extend your code using GraalVM's high performance and polyglot capabilities,"3,100",12,5.0 out of 5 stars,10-Aug-21,(20% off),by A B Vijay Kumar | 10 August 2021
"ASP.NET Core 3 and React: Hands-On full stack web development using ASP.NET Core, React, and TypeScript 3","2,464",23,4.4 out of 5 stars,27-Dec-19,(20% off),by Carl Rippon | 27 December 2019
Learn Blockchain Programming with JavaScript: Build your very own Blockchain and decentralized network with JavaScript and Node.js,"2,464",7,3.8 out of 5 stars,30-Nov-18,(20% off),by Eric Traub | 30 November 2018
"Learning Geospatial Analysis with Python: Understand GIS fundamentals and perform remote sensing data analysis using Python 3.7, 3rd Edition","3,100",26,4.4 out of 5 stars,27-Sep-19,(20% off),by Joel Lawhead | 27 September 2019
"Learning Python for Forensics: Leverage the power of Python in forensic investigations, 2nd Edition","2,782",11,4.3 out of 5 stars,01-Jan-19,(20% off),by Preston Miller Chapin Bryce | 1 January 2019
Deep Learning with PyTorch: A practical approach to building neural network models using PyTorch,"2,464",16,3.6 out of 5 stars,23-Feb-18,(20% off),by Vishnu Subramanian | 23 February 2018
"Getting Started with Tableau 2019.2: Effective data visualization and business intelligence with the new features of Tableau 2019.2, 2nd Edition","1,828",30,4.5 out of 5 stars,14-Jun-19,(20% off),by Tristan Guillevin | 14 June 2019
Building a Game with Unity and Blender: Give life to your ideas by developing complete 3D games with the Unity game engine and Blender,"2,782",12,4.1 out of 5 stars,27-Nov-15,(20% off),by Lee Zhi Eng | 27 November 2015
Bioinformatics with Python Cookbook - Third Edition: Use modern Python libraries and applications to solve real-world computational biology problems,"3,259",,,29-Jul-22,(20% off),by Tiago Antao | 29 July 2022
"Practical Mobile Forensics: Dive into mobile forensics on iOS, Android, Windows, and BlackBerry devices with this action-packed, practical guide","3,737",14,4.4 out of 5 stars,21-Jul-14,(20% off),"by Satish Bommisetty , Rohit Tamma , et al. | 21 July 2014"
The Deep Learning with PyTorch Workshop: Build deep neural networks and artificial intelligence applications with PyTorch,"2,226",4,4.3 out of 5 stars,22-Jul-20,(20% off),by Hyatt Saleh | 22 July 2020
VBA Automation for Excel 2019 Cookbook: Solutions to automate routine tasks and increase productivity with Excel and other MS Office applications,"2,466",54,4.1 out of 5 stars,18-Sep-20,(20% off),by Mike Van Niekerk | 18 September 2020
"Business Intelligence with Databricks SQL Analytics: Concepts, Tools, and Techniques for scaling Business Intelligence on the Data Lakehouse","2,704",,,09-Sep-22,(20% off),by Vihag Gupta | 9 September 2022
Mastering Ansible: Automate configuration management and overcome deployment challenges with Ansible,"2,464",14,4.2 out of 5 stars,09-Dec-21,(20% off),by James Freeman and Jesse Keating | 9 December 2021
Mastering ServiceNow Scripting: Leverage JavaScript APIs to perform client-side and server-side scripting on ServiceNow instances,"2,465",35,4.3 out of 5 stars,27-Feb-18,(20% off),by Andrew Kindred | 27 February 2018
"Learning C# by Developing Games with Unity 2021: Kickstart your C# programming and Unity journey by building 3D games from scratch, 6th Edition","2,464",93,4.5 out of 5 stars,29-Oct-21,(20% off),by Harrison Ferrone | 29 October 2021
Hands-On GPU-Accelerated Computer Vision with OpenCV and CUDA: Effective techniques for processing complex image data in real time using GPUs,"3,100",17,4.1 out of 5 stars,26-Sep-18,(20% off),by Bhaumik Vaidya | 26 September 2018
"Tensorflow Deep Learning Projects: 10 real-world projects on computer vision, machine translation, chatbots, and reinforcement learning",999,9,3.9 out of 5 stars,01-Jan-18,(68% off),by Luca Massaron Alberto Boschetti Alexey Grigorev rajalingappaa shanmugamani Abhishek Thakur | 1 January 2018
Fast Data Processing with Spark -,"14,653",1,3.0 out of 5 stars,31-Mar-15,,by Krishna Sankar and Holden Karau | 31 March 2015
The Deep Learning Workshop: Take a hands-on approach to understanding deep learning and build smart applications that can recognize images and interpret text,"2,464",7,4.8 out of 5 stars,31-Jul-20,(20% off),"by Mirza Rahim Baig , Thomas V. Joseph , et al. | 31 July 2020"
Drupal 8 Module Development: Build and customize Drupal 8 modules and extensions efficiently,"2,782",18,4.2 out of 5 stars,27-Oct-17,(20% off),by Daniel Sipos | 27 October 2017
Mastering OpenCV Android Application Programming,"3,100",2,4.1 out of 5 stars,29-Jul-15,(20% off),by Salil Kapur and Nisarg Thakkar | 29 July 2015
Mastering QuickBooks® 2022: The bestselling guide to bookkeeping and the QuickBooks Online accounting software,"1,669",73,4.2 out of 5 stars,31-Jan-22,(20% off),by Crystalynn Shelton | 31 January 2022
Getting Started with Amazon SageMaker Studio: Learn to build end-to-end machine learning projects in the SageMaker machine learning IDE,"2,464",2,5.0 out of 5 stars,31-Mar-22,(20% off),by Michael Hsieh | 31 March 2022
Pentaho Data Integration Beginner's Guide,"3,100",14,4.0 out of 5 stars,24-Oct-13,(20% off),by Maria Carina Roldan | 24 October 2013
ASP.NET Core 6 and Angular: Full-stack web development with ASP.NET 6 and Angular 13,"3,100",12,4.0 out of 5 stars,06-Apr-22,(20% off),by Valerio De Sanctis | 6 April 2022
Google Cloud Platform for Developers: Build highly scalable cloud solutions with the power of Google Cloud Platform,"2,782",9,4.2 out of 5 stars,30-Jul-18,(20% off),by Ted Hunter and Steven Porter | 30 July 2018
Learning Predictive Analytics with Python,"3,100",10,3.3 out of 5 stars,06-Jan-16,(20% off),by Ashish Kumar | 6 January 2016
"ASP.NET Core 5 and React: Full-stack web development using .NET 5, React 17, and TypeScript 4, 2nd Edition","2,464",43,4.4 out of 5 stars,08-Jan-21,(20% off),by Carl Rippon | 8 January 2021
Troubleshooting NetScaler,"2,782",20,4.7 out of 5 stars,06-Jan-16,(20% off),by Raghu Varma Tirumalaraju | 6 January 2016
"Python Web Scraping Cookbook: Over 90 proven recipes to get you scraping with Python, microservices, Docker, and AWS","2,464",11,4.0 out of 5 stars,09-Feb-18,(20% off),by Michael Heydt | 9 February 2018
Microsoft 365 and SharePoint Online Cookbook: Over 100 actionable recipes to help you perform everyday tasks effectively in Microsoft 365,"2,941",194,4.4 out of 5 stars,26-Jun-20,(20% off),by Gaurav Mahajan and Sudeep Ghatak | 26 June 2020
ReactJS by Example - Building Modern Web Applications with React,"2,853",8,2.9 out of 5 stars,06-Jan-16,(18% off),by Vipul A M and Prathamesh Sonpatki | 6 January 2016
"Practical Digital Forensics: Get started with the art and science of digital forensics with this practical, hands-on guide!","3,101",23,4.4 out of 5 stars,06-Jan-16,(20% off),by Richard Boddington | 6 January 2016
Implementing Devops with Microsoft Azure: Automate your deployments and incorporate the DevOps culture,"3,100",8,2.4 out of 5 stars,01-Jan-17,(20% off),by Mitesh Soni | 1 January 2017
ASP.NET 4 Social Networking,"1,850",6,2.7 out of 5 stars,23-Mar-11,(50% off),"by Atul Gupta, Sudhanshu Hate, et al. | 23 March 2011"
"ASP.NET Core 5 and React: Full-stack web development using .NET 5, React 17, and TypeScript 4, 2nd Edition","2,464",43,4.4 out of 5 stars,08-Jan-21,(20% off),by Carl Rippon | 8 January 2021
Troubleshooting NetScaler,"2,782",20,4.7 out of 5 stars,06-Jan-16,(20% off),by Raghu Varma Tirumalaraju | 6 January 2016
iPhone with Microsoft Exchange Server 2010: Business Integration and Deployment,"2,499",1,4.0 out of 5 stars,20-Mar-12,(47% off),by Steve Goodman | 20 March 2012
Liferay User Interface Development,799,2,3.0 out of 5 stars,24-Nov-10,(50% off),"by Jonas X. Yuan , Xinsheng Chen, et al. | 24 November 2010"
AWS Tools for PowerShell 6,"2,600",2,4.5 out of 5 stars,03-Aug-17,(26% off),by Ramesh Waghmare | 3 August 2017
Learning SAP BusinessObjects Dashboards,"2,500",1,4.0 out of 5 stars,29-Jun-15,(42% off),by Taha M. Mahmoud | 29 June 2015
Magento 1.4 Themes Design,"1,499",2,1.0 out of 5 stars,13-Jan-11,(50% off),by Richard Carter | 13 January 2011
Implementing Azure Solutions,"1,499",3,1.0 out of 5 stars,19-May-17,(62% off),"by Florian Klaffenbach, Jan-Henrik Damaschke, et al. | 19 May 2017"
"Python Web Scraping Cookbook: Over 90 proven recipes to get you scraping with Python, microservices, Docker, and AWS","2,464",11,4.0 out of 5 stars,09-Feb-18,(20% off),by Michael Heydt | 9 February 2018
Microsoft 365 and SharePoint Online Cookbook: Over 100 actionable recipes to help you perform everyday tasks effectively in Microsoft 365,"2,941",194,4.4 out of 5 stars,26-Jun-20,(20% off),by Gaurav Mahajan and Sudeep Ghatak | 26 June 2020
ReactJS by Example - Building Modern Web Applications with React,"2,853",8,2.9 out of 5 stars,06-Jan-16,(18% off),by Vipul A M and Prathamesh Sonpatki | 6 January 2016
"Practical Digital Forensics: Get started with the art and science of digital forensics with this practical, hands-on guide!","3,101",23,4.4 out of 5 stars,06-Jan-16,(20% off),by Richard Boddington | 6 January 2016
Implementing Devops with Microsoft Azure: Automate your deployments and incorporate the DevOps culture,"3,100",8,2.4 out of 5 stars,01-Jan-17,(20% off),by Mitesh Soni | 1 January 2017
Learning pandas -,"3,101",6,4.0 out of 5 stars,30-Jun-17,(20% off),by Michael Heydt | 30 June 2017
Microsoft Power BI Quick Start Guide: Build dashboards and visualizations to make your data come to life,"3,418",163,4.3 out of 5 stars,30-Jul-18,(20% off),"by Devin Knight, Brian Knight, et al. | 30 July 2018"
"Mobile Development with .NET: Build cross-platform mobile applications with Xamarin.Forms 5 and ASP.NET Core 5, 2nd Edition","2,464",13,3.9 out of 5 stars,09-Apr-21,(20% off),by Can Bilgin | 9 April 2021
"Django 3 Web Development Cookbook: Actionable solutions to common problems in Python web development, 4th Edition","2,226",48,4.2 out of 5 stars,23-Mar-20,(20% off),by Aidas Bendoraitis and Jake Kronika | 23 March 2020
Industrial Cybersecurity: Efficiently secure critical infrastructure systems,"3,577",54,4.7 out of 5 stars,18-Oct-17,(20% off),by Pascal Ackerman | 18 October 2017
Practical Threat Intelligence and Data-Driven Threat Hunting: A hands-on guide to threat hunting with the ATT&CK™ Framework and open source tools,"2,464",125,4.6 out of 5 stars,12-Feb-21,(20% off),by Valentina Palacin | 12 February 2021
Python Geospatial Development - Third Edition,"3,100",5,4.2 out of 5 stars,06-Jan-16,(20% off),by Erik Westra | 6 January 2016
"Flutter Projects: A practical, project-based guide to building real-world cross-platform mobile applications and games","1,828",36,4.2 out of 5 stars,07-Apr-20,(20% off),by Simone Alessandria | 7 April 2020
"OpenCV 4 with Python Blueprints: Build creative computer vision projects with the latest version of OpenCV 4 and Python 3, 2nd Edition","2,782",8,4.4 out of 5 stars,20-Mar-20,(20% off),"by Dr. Menua Gevorgyan , Arsen Mamikonyan, et al. | 20 March 2020"
Full-Stack Web Development with GraphQL and React: Taking React from frontend to full-stack with GraphQL and Apollo,"2,784",4,3.5 out of 5 stars,28-Feb-22,(20% off),by Sebastian Grebe | 28 February 2022
Mastering Adobe Photoshop Elements: Excel in digital photography and image editing for print and web using Photoshop Elements 2019,"2,782",22,4.6 out of 5 stars,26-Aug-19,(20% off),by Robin Nichols | 26 August 2019
"Limitless Analytics with Azure Synapse: An end-to-end analytics service for data processing, management, and ingestion for BI and ML requirements","3,171",29,4.1 out of 5 stars,18-Jun-21,(19% off),by Prashant Kumar Mishra and Mukesh Kumar | 18 June 2021
Go Design Patterns,"3,100",6,2.8 out of 5 stars,24-Feb-17,(20% off),by Mario Castro Contreras | 24 February 2017
ASP.NET jQuery Cookbook,"2,199",6,3.4 out of 5 stars,26-Apr-11,(50% off),by Sonal Aneel Allana | 26 April 2011
Oracle E-Business Suite 12 Financials Cookbook,"3,439",6,4.0 out of 5 stars,17-Aug-11,(36% off),by Yemi Onigbode | 17 August 2011
JasperReports 3.5 for Java Developers,"1,750",6,4.0 out of 5 stars,15-Dec-10,(50% off),by David R. Heffelfinger | 15 December 2010
Moodle 1.9 Extension Development,"1,399",4,3.2 out of 5 stars,15-Dec-10,(64% off),by Jonathan Moore and Michael Churchward | 15 December 2010
Mastering Python Forensics,"1,900",4,4.4 out of 5 stars,30-Oct-15,(41% off),by Dr. Michael Spreitzenbarth and Dr. Johann Uhrmann | 30 October 2015
3D Printing with SketchUp,"1,431",38,4.2 out of 5 stars,21-May-14,(20% off),by Marcus Ritland | 21 May 2014
"Ein Kriegskind packt aus: Teil 2, Gelungene Integration in Deutschland - 1989 bis 2000","1,832",,,08-Jul-20,(12% off),German Edition | by Heinz Hofmann | 8 July 2020
Ein Kriegskind packt aus: Teil 1 - 1940 bis 1989,"1,819",,,08-Jul-20,(12% off),German Edition | by Heinz Hofmann | 8 July 2020
"Ein Kriegskind packt aus: Teil 3, Schicksalsjahre und Zeitläufte, 2001 bis 2020","1,989",,,09-Jul-20,(13% off),German Edition | by Heinz Hofmann | 9 July 2020
Designing and Implementing Microsoft DevOps Solutions AZ-400 Exam Guide -: Ace the certification exam and successfully apply Azure DevOps strategies with practical labs,"2,703",,,07-Oct-22,(20% off),"by Subhajit Chatterjee , Henry Been, et al. | 7 October 2022"
Python Network Programming Cookbook -: Practical solutions to overcome real-world networking challenges,"3,100",2,3.6 out of 5 stars,09-Aug-17,(20% off),by Pradeeban Kathiravelu and Dr. M. O. Faruque Sarker | 9 August 2017
Android UI Development with Jetpack Compose: Bring declarative and native UIs to life quickly and easily on Android using Jetpack Compose,"2,466",12,3.7 out of 5 stars,21-Feb-22,(20% off),by Thomas Kunneth | 21 February 2022
"Edge computing with K3os and k3s: A use-case guide for building edge systems using K3os, K3s and other open source cloud native technologies:","2,943",,,09-Sep-22,(20% off),by Sergio Mendez | 9 September 2022
"Mastering Python Design Patterns: A guide to creating smart, efficient, and reusable software, 2nd Edition","2,784",43,4.4 out of 5 stars,31-Aug-18,(20% off),by Kamon Ayeva and Sakis Kasampalis | 31 August 2018
Mastering Qlik Sense: Expert techniques on self-service data analytics to create enterprise ready Business Intelligence solutions,"3,100",46,4.0 out of 5 stars,16-Mar-18,(20% off),by Juan Ignacio Vitantonio and Martin Mahler | 16 March 2018
Hands-On Machine Learning with scikit-learn and Scientific Python Toolkits: A practical guide to implementing supervised and unsupervised machine learning algorithms in Python,"2,464",14,4.8 out of 5 stars,24-Jul-20,(20% off),by Tarek Amr | 24 July 2020
Learning Concurrency in Python,"2,782",3,2.0 out of 5 stars,16-Aug-17,(20% off),by Elliot Forbes | 16 August 2017
"Bayesian Analysis with Python: Introduction to statistical modeling and probabilistic programming using PyMC3 and ArviZ, 2nd Edition","2,782",38,4.1 out of 5 stars,26-Dec-18,(20% off),by Osvaldo Martin | 26 December 2018
Python for Finance Cookbook: Over 50 recipes for applying modern Python libraries to financial data analysis,"2,464",36,4.1 out of 5 stars,31-Jan-20,(20% off),by Eryk Lewinson | 31 January 2020
"PostGIS Cookbook: Store, organize, manipulate, and analyze spatial data, 2nd Edition","3,100",7,3.9 out of 5 stars,28-Mar-18,(20% off),"by Mayra Zurbarán, Thomas Kraft, et al. | 28 March 2018"
Data Analysis and Machine Learning with Kaggle: How to compete on Kaggle and build a successful career in data science,"2,784",60,4.5 out of 5 stars,11-Apr-22,(20% off),"by Konrad Banachewicz , Luca Massaron , et al. | 11 April 2022"
"Metasploit Penetration Testing Cookbook: Evade antiviruses, bypass firewalls, and exploit complex environments with the most widely used penetration testing framework, 3rd Edition","2,782",37,4.9 out of 5 stars,26-Feb-18,(20% off),"by Abhinav Singh, Nipun Jaswal, et al. | 26 February 2018"
Learn MongoDB 4.x: A guide to understanding MongoDB development and administration for NoSQL developers,"2,464",4,4.7 out of 5 stars,11-Sep-20,(20% off),by Doug Bierer | 11 September 2020
Xamarin.Forms Projects: Build seven real-world cross-platform mobile apps with C# and Xamarin.Forms,"2,464",23,4.6 out of 5 stars,27-Dec-18,(20% off),by Johan Karlsson and Daniel Hindrikes | 27 December 2018
Advanced Machine Learning with Python: Solve data science problems by mastering cutting-edge machine learning techniques in Python,"2,782",11,4.0 out of 5 stars,06-Jan-16,(20% off),by John Hearty | 6 January 2016
Getting Started with Python and Raspberry Pi,"2,464",3,4.1 out of 5 stars,29-Sep-15,(20% off),by Dan Nixon | 29 September 2015
Bioinformatics with R Cookbook,"3,899",9,2.9 out of 5 stars,23-Jun-14,,by Paurush Praveen Sinha | 23 June 2014
"AI Crash Course: A fun and hands-on introduction to machine learning, reinforcement learning, deep learning, and artificial intelligence with Python","1,828",64,4.2 out of 5 stars,29-Nov-19,(20% off),by Hadelin de Ponteves | 29 November 2019
Learning Functional Data Structures and Algorithms,"2,782",4,5.0 out of 5 stars,23-Feb-17,(20% off),by Atul S. Khot and Raju Kumar Mishra | 23 February 2017
"Mastering OpenCV 4 with Python: A practical guide covering topics from image processing, augmented reality to deep learning with OpenCV 4 and Python 3.7","2,853",32,4.0 out of 5 stars,29-Mar-19,(18% off),by Alberto Fernández Villán | 29 March 2019
"The The Go Workshop: Learn to write clean, efficient code and build high-performance applications with Go","2,464",16,4.7 out of 5 stars,30-Dec-19,(20% off),"by Delio D'Anna , Andrew Hayes , et al. | 30 December 2019"
Oracle Siebel CRM 8 Developer's Handbook,"4,293",6,4.7 out of 5 stars,26-Apr-11,(20% off),by Alexander Hansal | 26 April 2011
